{"forecast_weeks":["2011-12-05","2011-12-12","2011-12-19","2011-12-26","2012-01-02","2012-01-09","2012-01-16","2012-01-23"],"horizon_weeks":8,"interval":{"level":0.8,"method":"Empirical 10th and 90th percentiles of the best model's backtest errors per series and horizon (all origins; coverage checked out of sample in backtest.json)."},"model":"mean4","schema_version":"v1","series":[{"family":"Bags and purses","forecast":[18624.5,18624.5,18624.5,18624.5,18624.5,18624.5,18624.5,18624.5],"hi":[23558.0,24657.8,23906.2,24646.0,23729.6,24122.5,24116.5,24650.9],"history_units":[11829,14469,1755,0,10083,8793,6890,9687,7206,6194,20785,10060,8549,7078,8974,10146,9990,8619,9970,9047,13620,12313,10428,6782,8847,6542,17538,6796,8465,16004,10486,9026,11950,7499,9872,20874,10792,6745,15242,11421,10659,12215,19048,10880,15208,7293,6802,12306,15018,12010,9513,10997,9274,6365,3540,0,9929,8663,6795,5950,7464,4020,9396,8846,6113,8794,12729,10723,15340,8146,12462,7858,6851,9283,22168,13969,13940,9774,12798,13583,13401,14071,15847,9420,15984,13416,16435,18958,15194,17185,10467,13978,14387,18097,12298,20382,11545,12313,14280,13807,23297,19119,14999,17083],"id":"family:Bags and purses","kind":"family","label":"Bags and purses","lo":[14611.2,14760.5,15950.4,16140.5,15955.7,16136.2,15780.7,15989.1],"skill_vs_snaive_pct":35.34053192269314,"snaive_wape_pct":35.2793798650798,"total_units":1174051,"wape_pct":22.811459361733093},{"family":"Bath and personal care","forecast":[1448.0,1448.0,1448.0,1448.0,1448.0,1448.0,1448.0,1448.0],"hi":[1979.8,1948.5,2006.1,1954.2,2030.1,2146.3,1947.1,1959.4],"history_units":[4976,3683,1632,0,3599,1214,1244,1489,1547,831,1623,1488,2700,1607,1621,1242,959,1548,1309,2266,1736,1766,862,960,1099,934,828,1184,651,994,1051,880,1217,900,824,2617,1699,1889,953,741,1026,2999,3425,2217,2224,1550,1177,1143,1957,2046,1334,1523,1533,1464,1237,0,1178,803,1023,738,1147,794,639,741,683,1648,747,1121,1205,645,1409,736,641,1047,1362,982,1196,659,1411,1130,629,1366,1052,1474,1206,655,574,1867,872,1368,647,1544,725,1987,822,1457,766,1500,836,1247,1059,1225,1646,1862],"id":"family:Bath and personal care","kind":"family","label":"Bath and personal care","lo":[962.0,998.2,1020.3,1014.5,1067.9,1099.5,1042.9,1078.6],"skill_vs_snaive_pct":41.63986071114923,"snaive_wape_pct":52.18600784447476,"total_units":139289,"wape_pct":30.45582686732606},{"family":"Candles and fragrance","forecast":[10399.0,10399.0,10399.0,10399.0,10399.0,10399.0,10399.0,10399.0],"hi":[12447.2,13078.5,13202.4,13670.5,14026.3,13841.6,13863.9,14184.5],"history_units":[17338,16417,2821,0,13777,10851,20233,10758,5236,5403,6430,9269,15391,8586,9573,11559,6658,6990,6893,10072,10736,11448,10113,8701,11902,7309,12979,7438,6421,7965,6944,9691,6198,7334,6728,15492,11034,7469,6921,6902,7733,7895,15247,12555,9877,8013,11233,9533,13553,11226,16241,17839,11225,10601,2426,0,6843,10182,5498,5430,5571,3964,5531,7257,5788,5366,5100,6084,5005,5679,5322,8187,5891,8427,8794,9675,6900,4923,7220,6241,5681,4606,5454,5792,6935,4953,5362,5522,5675,5909,6433,6390,7707,8994,5626,7082,7326,8445,12177,10061,9604,11457,10849,9686],"id":"family:Candles and fragrance","kind":"family","label":"Candles and fragrance","lo":[9022.8,9087.6,8989.4,8673.5,8991.9,8745.0,8409.3,8368.2],"skill_vs_snaive_pct":57.66280744015976,"snaive_wape_pct":42.89467129797918,"total_units":871781,"wape_pct":18.16039958533597},{"family":"Garden and outdoor","forecast":[1667.8,1667.8,1667.8,1667.8,1667.8,1667.8,1667.8,1667.8],"hi":[2500.4,2412.9,2483.6,2553.2,2638.7,2675.7,2751.6,2935.4],"history_units":[3383,2063,195,0,4820,3727,1300,1238,809,914,6463,3219,2192,1574,1817,2993,3844,2358,3729,3727,3756,4685,3373,5112,3467,1550,3427,2401,1793,3232,2219,1428,2227,988,1884,970,1419,1423,628,859,1342,1324,1100,1864,1510,1727,956,1688,1476,2012,2278,1980,1318,869,582,0,1711,1209,1825,1414,1153,1466,1278,2220,1430,1437,2247,2927,2961,1966,2719,2428,1434,2458,2717,2953,1374,1746,4420,1848,1959,1456,2310,2840,2745,881,1531,1200,1144,1284,701,1023,1052,1012,1299,1258,1157,1815,1062,1690,1482,2135,1238,1816],"id":"family:Garden and outdoor","kind":"family","label":"Garden and outdoor","lo":[875.7,788.5,667.9,726.5,664.8,486.8,386.0,481.7],"skill_vs_snaive_pct":22.61977132483365,"snaive_wape_pct":38.809187541812236,"total_units":204663,"wape_pct":30.030638066828477},{"family":"Home decor","forecast":[23859.0,23859.0,23859.0,23859.0,23859.0,23859.0,23859.0,23859.0],"hi":[28674.4,29250.5,29193.1,30262.0,30342.5,30928.8,32764.8,34456.8],"history_units":[13762,24480,5263,0,9488,14178,29754,12425,11053,5910,19254,12439,17410,10340,15246,12078,7553,10577,10866,10338,13005,11074,13474,8833,12729,10023,12051,10550,8178,13258,7789,15200,10937,14547,13447,12685,16068,15579,11047,10570,12941,19929,20360,21284,24379,16738,15156,22774,28420,25485,21353,23341,16957,17102,4817,0,9775,12956,8463,7847,12666,5147,9917,13197,8631,9393,9363,10039,15626,10806,11482,10500,8347,9888,13662,15521,10722,10010,17021,9744,7576,8062,13543,11838,14822,12971,15276,13192,12421,14771,11757,18838,20495,25680,17875,25066,14780,25186,24741,24776,25994,24410,20460,24572],"id":"family:Home decor","kind":"family","label":"Home decor","lo":[20157.1,20081.0,21194.3,21875.8,22467.6,22486.2,22004.5,22754.0],"skill_vs_snaive_pct":12.26033032511269,"snaive_wape_pct":23.06777365323249,"total_units":1474319,"wape_pct":20.23958840469687},{"family":"Jewellery and accessories","forecast":[2978.8,2978.8,2978.8,2978.8,2978.8,2978.8,2978.8,2978.8],"hi":[3958.4,4074.5,4134.8,4308.0,4323.7,4344.5,4542.4,4557.3],"history_units":[2896,3414,481,0,2343,2232,1647,2411,1888,966,2644,1318,1781,1761,2104,1702,1257,3405,1382,2050,3150,2455,4516,1463,4277,858,3220,2663,3062,2614,1217,1625,2390,1968,1450,2358,2319,2972,12418,3096,2570,3165,2062,8727,4508,2950,1775,8931,3040,4162,4221,2743,1977,2720,771,0,2286,1246,2208,2636,722,413,1348,889,925,1138,2893,739,1538,991,704,816,706,1659,1615,1785,1365,983,2870,2538,2462,1561,1905,2659,2632,2691,1444,1477,1738,2850,1230,1847,2932,2991,3153,2552,2347,3626,5424,2530,2640,3705,3064,2506],"id":"family:Jewellery and accessories","kind":"family","label":"Jewellery and accessories","lo":[2110.6,2151.9,2219.2,2200.8,2241.4,2220.3,2446.3,2453.6],"skill_vs_snaive_pct":51.93191491103145,"snaive_wape_pct":69.80164080532006,"total_units":249074,"wape_pct":33.55231209579744},{"family":"Kitchen and dining","forecast":[25871.2,25871.2,25871.2,25871.2,25871.2,25871.2,25871.2,25871.2],"hi":[32910.9,32230.3,32470.2,33651.2,33216.3,32332.3,32109.3,32512.6],"history_units":[20250,22503,6086,0,15802,11578,21161,15033,13199,10779,33480,20681,17152,11312,28534,14771,13606,12930,16813,18237,17263,15267,17890,12600,25775,9276,22019,12026,10070,17911,16192,13874,13366,13497,9957,42201,19383,15146,13464,12631,18052,20822,55841,26451,23844,18407,16340,23722,21836,27842,25887,31821,24059,26937,12310,0,16806,23974,93685,13039,14315,11556,18552,17593,16170,14496,19502,16983,25837,13927,19294,20856,7540,15692,23471,22331,22528,11641,16327,25686,12798,19718,19496,15705,24393,23843,17085,19753,23734,17790,13805,21102,20482,38225,19325,27151,18765,23054,18537,27927,25102,27724,24395,26264],"id":"family:Kitchen and dining","kind":"family","label":"Kitchen and dining","lo":[17056.9,18547.9,18142.0,17663.8,18597.6,17321.2,18542.2,18047.4],"skill_vs_snaive_pct":13.037165805837947,"snaive_wape_pct":30.157587225447166,"total_units":2055860,"wape_pct":26.225892575825416},{"family":"Lighting","forecast":[7454.8,7454.8,7454.8,7454.8,7454.8,7454.8,7454.8,7454.8],"hi":[8964.0,9668.0,9671.1,10310.5,11100.9,11455.0,11288.7,11575.6],"history_units":[5165,5134,1555,0,5183,2924,4499,3711,3223,2568,17610,3871,4639,3603,3470,3390,2232,3415,5526,4113,2752,2573,8523,2205,3147,1100,4504,2487,2294,4338,2559,2740,2263,2181,2241,4064,4494,2237,2222,2523,3445,2995,3457,4584,4497,3375,2681,3414,4117,5639,2767,3990,2391,3753,2072,0,2606,5607,1828,1109,1467,883,2256,1732,1236,1995,2221,1131,2133,998,2594,6070,650,1336,2737,2077,1791,753,1928,2129,1478,1512,3492,1596,1968,2772,2034,2576,2333,1979,2564,2689,3385,3390,2043,2866,1769,3276,8677,4775,6532,9356,6451,7480],"id":"family:Lighting","kind":"family","label":"Lighting","lo":[6246.6,6515.7,6659.5,6569.5,6694.1,6776.2,6393.8,6583.4],"skill_vs_snaive_pct":45.67585546752716,"snaive_wape_pct":67.52124418465216,"total_units":336715,"wape_pct":36.680338280994356},{"family":"Other","forecast":[7249.5,7249.5,7249.5,7249.5,7249.5,7249.5,7249.5,7249.5],"hi":[9716.1,9636.4,10269.3,9587.2,10012.3,10243.7,10432.1,10513.8],"history_units":[7715,10288,1385,0,5113,4025,3072,4240,3329,3065,17018,4267,5695,6222,10244,5738,7110,7292,4348,4605,4866,4744,6056,4592,6370,3572,9210,7852,5897,5678,4942,4530,5822,3061,4809,6879,4476,5112,2423,3636,6414,5799,7899,5959,12953,10502,10948,8002,8065,9652,7284,6942,7179,4657,1321,0,3052,2239,2437,2942,4954,1740,5562,3006,2340,3265,4290,5314,6577,3244,3959,4541,3348,6790,5720,6918,3144,3000,6671,4433,4362,4368,6033,5194,3801,8007,5435,2861,3712,5833,4505,6070,3986,5809,3920,5615,4287,5346,4902,9235,6477,8383,6326,7812],"id":"family:Other","kind":"family","label":"Other","lo":[5795.8,5796.8,5771.1,5988.5,5974.3,5872.6,5863.3,5703.2],"skill_vs_snaive_pct":45.38802959146969,"snaive_wape_pct":46.20082373012146,"total_units":564639,"wape_pct":25.231180183991185},{"family":"Paper cards and wrap","forecast":[27225.5,27225.5,27225.5,27225.5,27225.5,27225.5,27225.5,27225.5],"hi":[34156.7,33978.7,35320.4,36150.2,36144.3,36846.6,37784.9,37602.9],"history_units":[15657,20303,4826,0,16683,10743,38914,13388,10038,9130,39793,12080,16521,13380,65121,57877,10789,12371,11397,11949,22499,15441,18208,25333,17052,11097,23602,16362,12229,25435,14314,15815,15638,12345,11542,52482,21444,13700,10143,12517,18105,23353,65736,27099,32603,24337,19428,24692,32318,28462,24328,25150,20907,14056,4777,0,13991,14462,12240,13744,12456,13931,15379,16645,14821,12283,17757,12461,17866,13319,18475,10164,8658,14309,17414,19666,9693,8109,17915,24663,16265,11964,15300,16218,23756,18997